[
  {
    "id": "calcaneal_tendon",
    "meshes": ["Calcaneal tendon.r"],
    "name": { "fi": "akillesjänne", "la": "Tendo calcaneus" },
    "description": "Kaksoiskantalihaksen ja leveän kantalihaksen yhteinen jänne, johon myös jalkapohjalihaksen jänne sulautuu; se kiinnittyy kantaluuhun. Kitkaa vähentää kaksi limapussia, toinen ihon ja jänteen, toinen jänteen ja kantaluun välissä.",
    "function": "Säären takaosaston pinnalliset lihakset ojentavat nilkkaa (plantaarifleksio) sen kautta; jos jänne repeää, jalkaterää ei saa ojennettua vastusta vastaan.",
    "sources": ["fipat-ta2", "teachme-leg-posterior"]
  },
  {
    "id": "plantar_aponeurosis",
    "meshes": ["Plantar aponeurosis.r"],
    "name": { "fi": "jalkapohjan kalvojänne", "la": "Aponeurosis plantaris" },
    "description": "Jalkapohjan kalvojänne, jonka alla on jalkapohjan lihasten pinnallisin kerros. Isonvarpaan loitontajalihas, varpaiden lyhyt koukistajalihas ja pikkuvarpaan loitontajalihas lähtevät osittain siitä.",
    "function": "Tukee jalkaterän pitkittäisiä holveja ja poikittaista holvia.",
    "sources": ["fipat-ta2", "teachme-foot", "teachme-foot-arches"]
  },
  {
    "id": "iliotibial_tract",
    "meshes": ["Iliotibial tract.r"],
    "name": { "fi": "suoliluu-sääriluukaista", "la": "Tractus iliotibialis" },
    "description": "Leveän peitinkalvon pitkittäinen paksuuntuma reiden ulkosivulla suoliluun kyhmystä sääriluun ulomman nivelnastan etulateraaliseen (Gerdyn) kyhmyyn. Iso pakaralihas ja leveän peitinkalvon jännittäjälihas kiinnittyvät siihen.",
    "function": "Osallistuu lonkan ojennukseen, loitonnukseen ja ulkokiertoon ja tukee polvea sivusuunnassa.",
    "sources": ["fipat-ta2", "teachme-fascia-lata", "teachme-gluteal"]
  },
  {
    "id": "quadriceps_tendon",
    "meshes": ["Quadriceps common tendon and patellar ligament.r"],
    "name": { "fi": "nelipäisen reisilihaksen jänne ja polvilumpioside", "la": "Tendo musculi quadricipitis femoris; Ligamentum patellae" },
    "description": "Nelipäisen reisilihaksen neljä osaa kiinnittyvät yhteisellä jänteellä polvilumpioon, joka on jänteen sisällä. Polvilumpion alapuolella jänne jatkuu polvilumpiositeenä sääriluun kyhmyyn.",
    "function": "Nelipäinen reisilihas ojentaa polvea tämän jänteen ja polvilumpiositeen kautta, ja jänteen sisällä oleva polvilumpio toimii tukipisteenä, joka lisää ojennuksen voimaa.",
    "sources": ["fipat-ta2", "teachme-thigh-anterior", "teachme-knee"]
  },
  {
    "id": "pes_anserinus",
    "meshes": ["Pes anserinus common tendon.r"],
    "name": { "fi": "hanhenjalka", "la": "Pes anserinus" },
    "description": "Räätälinlihaksen, hoikkalihaksen ja puolijänteisen lihaksen yhteinen kiinnityskohta sääriluun yläosan mediaalisella pinnalla.",
    "sources": ["fipat-ta2", "teachme-knee", "teachme-thigh-anterior", "teachme-thigh-medial", "teachme-thigh-posterior"]
  },
  {
    "id": "bicipital_aponeurosis",
    "meshes": ["Bicipital aponeurosis.r"],
    "name": { "fi": "hauislihaksen kalvojänne", "la": "Aponeurosis bicipitalis" },
    "description": "Sidekudoslevy, joka erkanee hauislihaksen jänteestä sen saapuessa kyynärvarteen. Se muodostaa kyynärtaipeen katon ja sulautuu kyynärvarren etuosan syvään kalvoon.",
    "sources": ["fipat-ta2", "teachme-upper-arm"]
  },
  {
    "id": "palmar_aponeurosis",
    "meshes": ["Aponeurosis palmaris.r"],
    "name": { "fi": "kämmenen kalvojänne", "la": "Aponeurosis palmaris" },
    "description": "Kämmenen syvän kalvon kolmionmuotoinen paksuuntuma kämmenen keskellä. Sen kärki kiinnittyy ranteen koukistajien pidäkkeeseen ja pitkän kämmenlihaksen jänteeseen, ja kanta jakautuu neljäksi kaistaleeksi, jotka kiinnittyvät ihoon ja sulautuvat koukistajajänteiden säietuppiin.",
    "function": "Parantaa otetta kiinnittämällä kämmenen ihoa ja suojaa alla kulkevia jänteitä.",
    "sources": ["fipat-ta2", "teachme-hand-fascia"]
  },
  {
    "id": "flexor_retinaculum_carpi",
    "meshes": ["Flexor retinaculum"],
    "name": { "fi": "ranteen koukistajien pidäke", "la": "Retinaculum flexorium carpi" },
    "description": "Ranteen etupuolen syvän kalvon nauha, joka muodostaa rannekanavan katon; kanavan läpi kulkevat keskihermo ja kyynärvarren pitkät koukistajajänteet. Pidäke ulottuu veneluusta ja isosta monikulmaluusta koukkuluun koukkuun ja herneluuhun ja jatkuu kyynärvarren kalvoon ja kämmenen kalvojänteeseen.",
    "function": "Pitää koukistajajänteet paikoillaan ja suojaa keskihermoa, jotta jänteet eivät nouse irti ranteesta ranteen koukistuksessa.",
    "sources": ["fipat-ta2", "teachme-hand-fascia"]
  },
  {
    "id": "extensor_expansion",
    "meshes": ["Extensor hood of 2nd finger.r", "Extensor hood of 3rd finger.r", "Extensor hood of 4th finger.r", "Extensor hood of 5th finger.r"],
    "name": { "fi": "sormien ojentajajänteiden laajentumat", "la": "Aponeurosis extensoria manus" },
    "description": "Rystysnivelen kohdalta alkava kolmionmuotoinen sidekudosrakenne, jonka kautta sormien ojentajalihaksen jänteet kiinnittyvät keski- ja kärkijäsenten tyviin. Siihen kiinnittyvät myös etusormen ja pikkusormen ojentajalihakset, luidenväliset lihakset ja matolihakset.",
    "function": "Tasapainottaa sormiin vaikuttavien monien lihasten voimia.",
    "sources": ["fipat-ta2", "teachme-extensor-expansion"]
  },
  {
    "id": "linea_alba",
    "meshes": ["Linea alba"],
    "name": { "fi": "valkoinen juova", "la": "Linea alba" },
    "description": "Sidekudosjuova vatsan keskiviivassa rintalastan miekkalisäkkeestä häpyliitokseen. Se muodostuu litteiden vatsalihasten kalvojänteiden punoutuessa yhteen ja jakaa suoran vatsalihaksen kahteen puoliskoon; pyramidilihas kiinnittyy siihen.",
    "sources": ["fipat-ta2", "teachme-abdominal-wall"]
  },
  {
    "id": "thoracolumbar_fascia",
    "meshes": ["Thoracolumbar fascia (posterior layer).r", "Thoracolumbar fascia (middle layer).r", "Thoracolumbar fascia (anterior layer).r", "Thoracolumbar fascia (cervical and thoracic part).r"],
    "name": { "fi": "rinta-lannekalvo", "la": "Fascia thoracolumbalis" },
    "description": "Selän ja vatsaontelon takaseinämän kalvo, jossa on takaseinämän kohdalla kolme kerrosta: selän syvät lihakset ovat taka- ja keskikerroksen välissä ja nelikulmainen lannelihas keski- ja etukerroksen välissä. Leveä selkälihas, sisempi vino vatsalihas ja poikittainen vatsalihas lähtevät osittain siitä.",
    "function": "Suojaa ja tukee vatsaontelon takaseinämän lihaksia.",
    "sources": ["fipat-ta2", "teachme-posterior-abdominal-wall", "teachme-abdominal-wall", "teachme-shoulder-extrinsic"]
  },
  {
    "id": "anterior_crural_intermuscular_septum",
    "meshes": ["Anterior intermuscular septum of leg.r"],
    "name": { "fi": "säären etummainen lihasväliseinämä", "la": "Septum intermusculare anterius cruris" },
    "description": "Säären sivu- ja etuosaston välinen lihasväliseinämä. Syvä pohjeluuhermo lävistää sen kulkiessaan sivuosastosta etuosastoon.",
    "sources": ["fipat-ta2", "teachme-deep-fibular-nerve"]
  },
  {
    "id": "crural_fascia",
    "meshes": ["Crural fascia.r"],
    "name": { "fi": "säären kalvo", "la": "Fascia cruris" },
    "description": "Säären syvä kalvo, joka jatkuu polven kohdalla leveästä peitinkalvosta ja on yhtenäinen nilkan koukistajien pidäkkeen kanssa. Pinnallinen pohjeluuhermo lävistää sen säären alakolmanneksessa.",
    "sources": ["fipat-ta2", "teachme-fascia-lata", "teachme-tarsal-tunnel", "teachme-superficial-fibular-nerve"]
  },
  {
    "id": "fascia_lata",
    "meshes": ["Fascia lata.r"],
    "name": { "fi": "leveä peitinkalvo", "la": "Fascia lata" },
    "description": "Reiden syvä kalvo, joka verhoaa reiden lihakset suoliluun harjulta ja nivussiteestä polveen asti ja jatkuu siitä säären kalvona. Sivulla se paksuuntuu suoliluu-sääriluukaistaksi, ja sen syvästä pinnasta lähtee kolme reisiluuhun kiinnittyvää lihasväliseinämää.",
    "function": "Jakaa väliseinämillään reiden lihakset osastoihin; kun leveän peitinkalvon jännittäjälihas kiristää sitä, se painaa etu- ja takaosaston lihaksia reisiluuta kohti ja tehostaa syvien laskimoiden tyhjenemistä lihasten supistuessa.",
    "sources": ["fipat-ta2", "teachme-fascia-lata"]
  },
  {
    "id": "flexor_retinaculum_tali",
    "meshes": ["Flexor retinaculum of ankle.r"],
    "name": { "fi": "nilkan koukistajien pidäke", "la": "Retinaculum flexorium tali" },
    "description": "Nilkan takasisäsivulla sisemmästä kehräksestä kantaluun mediaaliseen kyhmyyn vinosti kulkeva pidäke, joka muodostaa tarsaalikanavan katon. Isonvarpaan loitontajalihas lähtee osittain siitä.",
    "function": "Muuttaa luisen uurteen kanavaksi, jonka kautta takimmaisen säärilihaksen sekä varpaiden ja isonvarpaan pitkien koukistajalihasten jänteet, säärihermo ja takimmaiset säärisuonet kulkevat säären takaosasta jalkaterään.",
    "sources": ["fipat-ta2", "teachme-tarsal-tunnel", "teachme-foot"]
  },
  {
    "id": "gluteal_aponeurosis",
    "meshes": ["Gluteal aponeurosis.r"],
    "name": { "fi": "pakaran kalvojänne", "la": "Aponeurosis glutea" },
    "sources": ["fipat-ta2"]
  },
  {
    "id": "inferior_extensor_retinaculum",
    "meshes": ["Inferior extensor retinaculum.r"],
    "name": { "fi": "nilkan alempi ojentajien pidäke", "la": "Retinaculum extensorium inferius tali" },
    "description": "Jalkaterän selän kaksi lihasta, varpaiden lyhyt ojentajalihas ja isonvarpaan lyhyt ojentajalihas, lähtevät kantaluusta ja tästä pidäkkeestä.",
    "sources": ["fipat-ta2", "teachme-foot"]
  },
  {
    "id": "inferior_fibular_retinaculum",
    "meshes": ["Inferior fibular retinaculum.r"],
    "name": { "fi": "alempi pohjeluulihasten pidäke", "la": "Retinaculum fibulare inferius" },
    "sources": ["fipat-ta2"]
  },
  {
    "id": "lateral_femoral_intermuscular_septum",
    "meshes": ["Lateral femoral intermuscular septum.r"],
    "name": { "fi": "reiden lateraalinen lihasväliseinämä", "la": "Septum intermusculare laterale femoris" },